{
  "bounds_prior": {
    "max_abs_coefficient": 3,
    "max_abs_scale": 3,
    "name": "mhr-standard-normal-synthetic",
    "version": "1"
  },
  "coefficients": [
    0, 0, 0, 0, 0, 0, 0, 0, 0, 0, 0, 0, 0, 0, 0,
    0, 0, 0, 0, 0, 0, 0, 0, 0, 0, 0, 0, 0, 0, 0,
    0, 0, 0, 0, 0, 0, 0, 0, 0, 0, 0, 0, 0, 0, 0
  ],
  "content_sha256": "ed4b000260e5e5598ea00848b6f664a828a241e1791afa292e12b8db54d1a993",
  "model_spec_sha256": "234a951c4e534b5ec7826907eaf2ee86d1d287f62e26e530b85e1dff5d44bd1d",
  "provenance": {
    "created_utc": "2026-09-04T01:09:37Z",
    "producer": "tatbot-human-representation-fixture",
    "seed": 11,
    "source_sha256": "689f6a627384c7dcb2dcc1487e540223e77bdf9dcd0d8be8a326eda65b0ce9a4",
    "version": "1"
  },
  "rest_surface_sha256": "caa66dff9b3625771c8f4c35bfe59556d30acdc3800880106f98f0ce75c49a95",
  "scales": [
    0, 0, 0, 0, 0, 0, 0, 0, 0, 0, 0, 0, 0, 0, 0, 0, 0,
    0, 0, 0, 0, 0, 0, 0, 0, 0, 0, 0, 0, 0, 0, 0, 0, 0,
    0, 0, 0, 0, 0, 0, 0, 0, 0, 0, 0, 0, 0, 0, 0, 0, 0,
    0, 0, 0, 0, 0, 0, 0, 0, 0, 0, 0, 0, 0, 0, 0, 0, 0
  ],
  "schema": "tatbot.body-identity/1"
}
